Title,Date,URL,Description
The resilience assessment framework : assessing commercial contributions to U.S. Space Force mission resilience,2023,http://lccn.loc.gov/2023279357,"Over the past few years, commercial space services have significantly increased in capability and capacity in many missions of interest to the U.S. Space Force (USSF). As the USSF considers incorporating such commercial space services into its missions, it needs a principled and flexible assessment framework for evaluating how commercial contributions affect the performance and resilience of various USSF missions. This report describes the resilience assessment framework that RAND Project AIR FORCE developed to assess the potential impact of select commercial services on USSF space mission performance. The framework includes four components to help analysts consider the additional mission performance and mission resilience that a proposed commercial service could provide. The prospect of incorporating commercial capabilities into defense missions also raises the question of trustworthiness and information assurance. The assessment framework includes a subframework focused on grading information contributions from commercial services for trustworthiness. To demonstrate how the framework can be tailored to diverse missions by specifying the relevant mission assets or infrastructure, the commercial services available, and the mission performance measures, the authors apply the framework to two example missions: tactical intelligence, surveillance, and reconnaissance and data transmit and receive network. They then discuss their findings and propose several recommendations for the USSF to fully leverage the benefits of evaluating commercial capabilities with the resilience assessment framework."
Ethics of socially disruptive technologies : an introduction,2023,http://lccn.loc.gov/2022361311,"""Technologies shape who we are, how we organize our societies and how we relate to nature. For example, social media challenges democracy; artificial intelligence raises the question of what is unique to humans; and the possibility to create artificial wombs may affect notions of motherhood and birth. Some have suggested that we address global warming by engineering the climate, but how does this impact our responsibility to future generations and our relation to nature? This book shows how technologies can be socially and conceptually disruptive and investigates how to come to terms with this disruptive potential. Four technologies are studied: social media, social robots, climate engineering and artificial wombs. The authors highlight the disruptive potential of these technologies, and the new questions this raises. The book also discusses responses to conceptual disruption, like conceptual engineering, the deliberate revision of concepts.""-- Publisher's description."
China: Generative AI Measures Finalized,2023-07-18,http://www.loc.gov/item/global-legal-monitor/2023-07-18/china-generative-ai-measures-finalized/,"<p>On July 10, 2023, the Cyberspace Administration of China (CAC), joined by six other central government regulators, issued finalized measures aimed at regulating the provision of generative AI services, such as ChatGPT, to the public of mainland China. (Interim Measures for the Management of Generative Artificial Intelligence (AI) Services.) Previously, in April, the CAC released &hellip; </p> <p class=""link-more""><a href=""https://www.loc.gov/item/global-legal-monitor/2023-07-18/china-generative-ai-measures-finalized/"" class=""more-link"">Continue reading<span class=""screen-reader-text""> &#8220;China: Generative AI Measures Finalized&#8221;</span></a></p>"
Library of Congress Holds Symposium on Women Leadership in Tech and Investments for International Women's Day,2023-03-01,http://www.loc.gov/item/prn-23-018/,"<p>The Library of Congress Science, Technology and Business Division will co-sponsor an International Women’s Day symposium on Wednesday, March 8, with Parliament51, a social impact venture that promotes equal opportunities for women in the workforce. The symposium will bring together scientists, entrepreneurs and technology experts to discuss the current state of investments in technology, increasing women in leadership positions, and incorporating diverse thinking into problem-solving through technology.</p><p><strong>What:    </strong>International Women’s Day Symposium: Women Leadership in Tech and Investments</p><p><strong>When:   </strong>Wednesday, March 8, 9:30 a.m. – noon ET.  </p><p><strong>Where:  </strong>Montpelier Room, Madison Building Library of Congress,</p><p>              101 Independence Ave., Washington, DC. 20540</p><p><strong>Who:  Confirmed keynote speaker:</strong></p><p><strong>Dr. Vivienne Ming</strong>, neuroscientist, entrepreneur, inventor and artificial intelligence expert who will discuss issues related to inclusion and the future of work. Ming has founded six startups, been"
The Champion magazine.,1916-01-01,http://www.loc.gov/item/73644403/,"v. 1- Sept. 1916- ""A monthly survey of negro achievement."" Also available in digital form. SERBIB/SERLOC merged record"
China: Provisions on Deep Synthesis Technology Enter into Effect,2023-04-25,http://www.loc.gov/item/global-legal-monitor/2023-04-25/china-provisions-on-deep-synthesis-technology-enter-into-effect/,"<p>On January 10, 2023, China’s Administrative Provisions on Deep Synthesis in Internet-Based Information Services (Deep Synthesis Provisions) entered into effect. The deep synthesis provisions were jointly issued by three central government regulators — the Cyberspace Administration of China (CAC), Ministry of Industry and Information Technology (MIIT), and Ministry of Public Security (MPS) — on November &hellip; </p> <p class=""link-more""><a href=""https://www.loc.gov/item/global-legal-monitor/2023-04-25/china-provisions-on-deep-synthesis-technology-enter-into-effect/"" class=""more-link"">Continue reading<span class=""screen-reader-text""> &#8220;China: Provisions on Deep Synthesis Technology Enter into Effect&#8221;</span></a></p>"
Why Experiment: Machine Learning at the Library of Congress,2023-11-13,https://blogs.loc.gov/thesignal/2023/11/why-experiment-machine-learning-at-the-library-of-congress/,"Why Machine Learning? Everyone at the Library of Congress wants the materials we steward and the services we offer to be useful for as many people as possible. It&#8217;s why we do what we do! And across the Library, staff have long relied on technological innovations to enable people to use our materials to become &hellip;"
"Join Us on 11/30 for a Foreign and Comparative Law Webinar titled ""Review of Law Library of Congress Research Reports Published in 2023.""",2023-11-09,https://blogs.loc.gov/law/2023/11/join-us-on-11-30-for-a-foreign-and-comparative-law-webinar-titled-review-of-law-library-of-congress-research-reports-published-in-2023/,Today's blog post is an introduction to the November Foreign and Comparative Law Webinar which will provide a review of the legal research reports published in 2023.
The Most Viewed Legal Research Reports and Global Legal Monitor Articles of 2023,2024-01-11,https://blogs.loc.gov/law/2024/01/the-most-viewed-legal-research-reports-and-global-legal-monitor-articles-of-2023/,Today's blog post is a reflection on the most-viewed Global Legal Monitor and Legal Research Reports from 2023.
Strategic Plan 2.0: A Digitally-Infused Five-Year Plan,2023-11-08,https://blogs.loc.gov/thesignal/2023/11/strategic-plan-2-0/,"For decades, digital technologies have rewritten the playbook for government agencies, libraries, and cultural heritage organizations. The Library of Congress has investigated, implemented, and even invented new digital approaches and technical methods since the 1950s, aspiring better to serve Congress and the American people with each new technical turn. Today, technology fuels everything we do, &hellip;"
Digitizing Over 9 Million Historical Record Pages and Counting,2023-09-07,https://blogs.loc.gov/copyright/2023/09/digitizing-over-9-million-historical-record-pages-and-counting/,"The U.S. Copyright Office has now released over 9 million digitized pages documenting copyright registrations for books, periodicals, and unpublished musical works found in the Copyright Historical Record Books Collection"
Improvements Ahead for the Web Archives,2023-08-23,https://blogs.loc.gov/thesignal/2023/08/improvements-ahead-for-the-web-archives/,"Today&#8217;s guest post is from Abbie Grotke, Assistant Head of the Digital Content Management section at the Library of Congress. Users of the&#xA0;Library of Congress Web Archives&#xA0;may have recently noticed issues when trying to access archived content presented at&#xA0;webarchive.loc.gov.&#xA0;We&#xA0;want to give some background and explanation about the ongoing work that is happening to modernize and &hellip;"
Help the Library of Congress Create Video Games that Improve Public Knowledge of Civics,2023-06-07,https://blogs.loc.gov/thesignal/2023/06/help-the-library-of-congress-create-video-games-that-improve-public-knowledge-of-civics/,The Library of Congress is sponsoring a challenge to help improve public knowledge of civics through video games.
Qatar: New Draft Law Regulating Nationalization of Private Sector Jobs Approved,2023-03-01,http://www.loc.gov/item/global-legal-monitor/2023-03-01/qatar-new-draft-law-regulating-nationalization-of-private-sector-jobs-approved/,"<p>On February 8, 2023, Qatar’s Cabinet approved a draft law on workforce nationalization of certain private sector jobs. Proposed by the Ministry of Labor and Nationalization, the draft law would determine what jobs in the private sector will be nationalized.The draft law sets incentives that would be offered to private employers, including small and big &hellip; </p> <p class=""link-more""><a href=""https://www.loc.gov/item/global-legal-monitor/2023-03-01/qatar-new-draft-law-regulating-nationalization-of-private-sector-jobs-approved/"" class=""more-link"">Continue reading<span class=""screen-reader-text""> &#8220;Qatar: New Draft Law Regulating Nationalization of Private Sector Jobs Approved&#8221;</span></a></p>"
Check out: The Secret Life of GeoTIFFs,2023-08-21,https://blogs.loc.gov/thesignal/2023/08/check-out-the-secret-life-of-geotiffs/,"n October 2022, the outcomes of a 2015 experiment to geo-reference 4,998 digitized maps of the Austro-Hungarian empire were shared with the public at the Computing Cultural Heritage in the Cloud Data Jam. Check out this recent post on World's Revealed, the Library's Geography and Maps blog, to learn more about the resulting GeoTIFF files enable access to digitized historical maps."
H.R.2670 - 118th Congress (2023-2024): National Defense Authorization Act for Fiscal Year 2024,2023-12-22,https://www.congress.gov/bill/118th-congress/house-bill/2670,Summary of H.R.2670 - 118th Congress (2023-2024): National Defense Authorization Act for Fiscal Year 2024
S.2226 - 118th Congress (2023-2024): National Defense Authorization Act for Fiscal Year 2024,2023-07-27,https://www.congress.gov/bill/118th-congress/senate-bill/2226,Summary of S.2226 - 118th Congress (2023-2024): National Defense Authorization Act for Fiscal Year 2024
International: G20 Summit Leaders Release Final Declaration,2023-09-18,http://www.loc.gov/item/global-legal-monitor/2023-09-18/international-g20-summit-leaders-release-final-declaration/,"<p>On September 9–10, 2023, leaders of the Group of 20 (G20) nations met in Delhi, India, for the 2023 G20 summit meeting. The G20 New Delhi Leaders’ Declaration (final declaration) outlined 10 distinct areas where G20 countries have pledged their commitment to new initiatives and to continued support for ongoing goals of the G20 and &hellip; </p> <p class=""link-more""><a href=""https://www.loc.gov/item/global-legal-monitor/2023-09-18/international-g20-summit-leaders-release-final-declaration/"" class=""more-link"">Continue reading<span class=""screen-reader-text""> &#8220;International: G20 Summit Leaders Release Final Declaration&#8221;</span></a></p>"
United Kingdom: King's Speech Sets Out Government's Legislative Agenda,2023-11-30,http://www.loc.gov/item/global-legal-monitor/2023-11-30/united-kingdom-kings-speech-sets-out-governments-legislative-agenda/,"<p>On November 7, 2023, King Charles III delivered the King’s Speech at the state opening of the Parliament of the United Kingdom (U.K.), marking the formal start of the parliamentary year. The King’s Speech is prepared by the government and sets out the government’s legislative agenda for the upcoming parliamentary session. It outlines the proposed &hellip; </p> <p class=""link-more""><a href=""https://www.loc.gov/item/global-legal-monitor/2023-11-30/united-kingdom-kings-speech-sets-out-governments-legislative-agenda/"" class=""more-link"">Continue reading<span class=""screen-reader-text""> &#8220;United Kingdom: King’s Speech Sets Out Government’s Legislative Agenda&#8221;</span></a></p>"
"Congress.gov New, Tip, and Top – December 2023",2023-12-04,https://blogs.loc.gov/law/2023/12/congress-gov-new-tip-and-top-december-2023/,The Congress.gov enhancements for December of 2023.
France: New Law Establishes Legal Framework for 2024 Olympic and Paralympic Games,2023-11-15,http://www.loc.gov/item/global-legal-monitor/2023-11-15/france-new-law-establishes-legal-framework-for-2024-olympic-and-paralympic-games/,"<p>On May 19, 2023, France enacted Law No. 2023-380 to establish a comprehensive legal framework for the 2024 Olympic and Paralympic Games, which are scheduled to be held in Paris and several other cities from July 24 to September 8, 2024. This legislation is the culmination of a series of parliamentary amendments and includes legal &hellip; </p> <p class=""link-more""><a href=""https://www.loc.gov/item/global-legal-monitor/2023-11-15/france-new-law-establishes-legal-framework-for-2024-olympic-and-paralympic-games/"" class=""more-link"">Continue reading<span class=""screen-reader-text""> &#8220;France: New Law Establishes Legal Framework for 2024 Olympic and Paralympic Games&#8221;</span></a></p>"
"International Women's Day Symposium at the Library of Congress, March 8",2023-02-13,https://blogs.loc.gov/inside_adams/2023/02/international-womens-day/,"Join us in-person at the Library of Congress on the morning of Wednesday, March 8 for a conversation around the current state of investments in technology, increasing the percentage of women in leadership positions, and how to incorporate diverse thinking when solving for today's problems through technology."
Reflections on the 2023 Web Archiving Conference,2023-09-06,https://blogs.loc.gov/thesignal/2023/09/reflections-on-the-2023-web-archiving-conference/,"Today&#8217;s guest post is from Abbie Grotke (Assistant Head of the Digital Content Management section), Grace Bicho (Senior Digital Collections Specialist), Lauren Baker (Senior Digital Collections Specialist), and Abbey Potter (Senior Innovation Specialist), all from the Library of Congress. In May, the Library of Congress sent four representatives to the 2023 Web Archiving Conference and &hellip;"
Recommended Formats Statement: Updates for 2023-2024,2023-07-11,https://blogs.loc.gov/thesignal/2023/07/recommended-formats-statement-updates-for-2023-2024/,This post is provides updates to the Library of Congress's Recommended Formats Statement for 2023-2024.
Jump in! An Interview with Thomas Crowley,2023-11-21,https://blogs.loc.gov/thesignal/2023/11/jump-in-an-interview-with-thomas-crowley/,"I&#8217;m excited to share this interview with Thomas Crowley, one of my colleagues in the Digital Services Directorate here at the Library of Congress. My hope with this interview, and the others that we publish here, help spread awareness about the background, experience, and interests of the people that support the Library of Congress. Along &hellip;"
Join Us for a Congress.gov Public Forum on September 13th!,2023-08-21,https://blogs.loc.gov/law/2023/08/join-us-for-a-congress-gov-public-forum-on-september-13th/,This post promotes the 2023 Congress.gov Public Forum.
New Law Library Report Examines Cybersecurity Laws of Several Countries,2023-11-03,https://blogs.loc.gov/law/2023/11/new-law-library-report-examines-cybersecurity-laws-of-several-countries/,"For a recent report, the Law Library looked at whether and how the laws and policies of selected countries may have been influenced by the ""Cybersecurity Framework,"" which was developed by the National Institute of Standards and Technology (NIST) within the U.S. Department of Commerce."
What's new online at the Library of Congress – January 2023,2023-01-26,https://blogs.loc.gov/thesignal/2023/01/new-online-january-2023/,Interested in learning more about what&#8217;s new in the Library of Congress&#8217; digital collections? The Signal shares semi-regular updates of new additions to publicly available digital collections and we love showing off all the hard work of our colleagues from across the Library. Read on for a sample of what&#8217;s been added recently and some &hellip;
Relational Reconstruction Toolkit Now Available,2023-10-12,https://blogs.loc.gov/thesignal/2023/10/relational-reconstruction-toolkit-now-available/,"This post was co-written with LC writer and editor Sahar Kazmi. Relational Reconstruction Toolkit Now Available For the past year, Innovator in Residence Jeffrey Yoo Warren worked with LC staff, collections and community members to develop an open source “relational reconstruction” toolkit to share his methodology and inspire the public to reconstruct other lost enclaves &hellip;"
Native American Heritage Month Highlight: Reservation Dogs,2023-11-24,https://blogs.loc.gov/copyright/2023/11/native-american-heritage-month-highlight-reservation-dogs/,"During Native American Heritage Month, we celebrate the richness of Native American culture and its diverse array of creative expression. The U.S. Copyright Office&#8217;s records contain thousands of submissions from Native American creators in various artistic forms, including film, television, music, literature, and documents. Here we highlight the television series Reservation Dogs."
What's in a Name? The Four U.S. States That Are Technically Commonwealths,2023-08-16,https://blogs.loc.gov/law/2023/08/whats-in-a-name-the-four-u-s-states-that-are-technically-commonwealths/,A blog post about the history of four states being designated as commonwealths.
"Supporting Social-Emotional Learning Activities with ""By the People"" Transcriptions",2023-06-22,https://blogs.loc.gov/thesignal/2023/06/nakshbendi-residence/,"Today&#8217;s guest post is from Annette Nakshbendi, a Librarian-in-Residence in the Digital Content Management Section at the Library of Congress. How might a Library of Congress digital resource spark classroom discussion that reaches beyond a primary source&#8217;s content and context? You may have used the Library&#8217;s digital collections to help history &#8220;come alive&#8221; for students. &hellip;"
Introducing Massachusetts Newspapers on Chronicling America,2023-06-27,https://blogs.loc.gov/headlinesandheroes/2023/06/introducing-massachusetts-newspapers-on-chronicling-america/,"Boston Public Library (BPL) in Massachusetts is one of our newest partners for Chronicling America. In this interview we learn about how they selected newspapers spanning nearly 200 years of American history, beginning with the birth of the United States as a nation in the 1770s, and what they have learned along the way. Read about these incredible early newspapers and how to search them."
Find Sports in Copyright,2023-01-05,https://blogs.loc.gov/copyright/2023/01/find-sports-in-copyright/,"While athletic moves or goal celebrations are creative, they are not protected by copyright law. Creative works inspired by sports, however, may be protected by copyright, such as photographs, movies, and music."
The Copyright Claims Board Celebrates Its First Year,2023-06-26,https://blogs.loc.gov/copyright/2023/06/the-copyright-claims-board-celebrates-its-first-year/,"The Copyright Claims Board (CCB) provides an efficient, streamlined way to resolve copyright claims involving damages of up to $30,000."
Chichén Itzá – Pic of the Week,2023-09-22,https://blogs.loc.gov/law/2023/09/chichn-itz-pic-of-the-week/,"The pictures for this week come from the ancient city of Chichen Itza, located on the Yucatan peninsula in Mexico."
Volunteer Vignette: Transcribing Spanish history,2023-02-23,https://blogs.loc.gov/thesignal/2023/02/volunteer-vignette-claude/,"In today&#8217;s post, Abby Shelton interviews a&#xA0;By the People&#xA0;volunteer,&#xA0;Claude,&#xA0;who has gone above and beyond!&#xA0;By the People&#xA0;is a crowdsourced transcription program launched in 2018 at the Library of Congress. Volunteer-created transcriptions are used to make digitized collections more accessible and discoverable on&#xA0;loc.gov.&#xA0;You can read our other Volunteer Vignettes on the Signal&#xA0;here&#xA0;and&#xA0;here. Abby: What motivates you to &hellip;"
"Jackie Katz, 2022–23 Einstein Fellow, on science education and LC collections",2023-03-09,https://blogs.loc.gov/thesignal/2023/03/jackie-katz-2022-23-einstein-fellow-on-science-education-and-lc-collections/,"Jacqueline Katz is the 2022-2023 Albert Einstein Distinguished Educator, exploring LC materials related to science education."
3rd Edition of FADGI Still Image Digitization Guidelines Finalized,2023-05-11,https://blogs.loc.gov/thesignal/2023/05/fadgi-third-edition-still-image/,"Today&#8217;s guest post is from Hana Beckerle, a&#xA0;Digital Imaging Specialist in the Digitization Services Section at the Library of Congress. The Federal Agencies Digital Guidelines Initiative (FADGI) Still Image Working Group has finalized the Third Edition of its influential Technical Guidelines for Digitizing Cultural Heritage Materials. The Working Group published a draft version of the &hellip;"
New FADGI Project: Researching Accessibility in Open-Source Digital Preservation Applications,2023-05-30,https://blogs.loc.gov/thesignal/2023/05/new-fadgi-project-researching-accessibility-in-open-source-digital-preservation-applications/,"This is a guest post from Chris Lacinak, Founder and CEO of AVP, and Kate Murray, Digital Projects Coordinator in Digital Collections Management and Services at the Library of Congress. Recognizing the importance of meeting the Library of Congress&#8217;s goals and mission related to accessibility, the Federal Agencies Digital Guidelines Initiative (FADGI) has embarked on &hellip;"
Relational Reconstruction of the Portland Chinese Vegetable Gardens,2023-05-09,https://blogs.loc.gov/thesignal/2023/05/relational-reconstruction-of-the-portland-chinese-vegetable-gardens/,"The following is a guest post by Dri Chiu Tattersfield (they/he), an artist and educator from Taipei, Taiwan and Portland, Oregon who loves maps and moss, and the Library&#8217;s 2023 Innovator in Residence Jeffrey Yoo Warren. As part of his residency, Warren will publish a toolkit to empower communities to create relational reconstructions of destroyed &hellip;"
What's new online at the Library of Congress – July 2023,2023-07-27,https://blogs.loc.gov/thesignal/2023/07/new-loc-july-2023/,Interested in learning more about what&#8217;s new in the Library of Congress&#8217; digital collections? The Signal shares updates on new additions to our digital collections and we love showing off all the hard work of our colleagues from across the Library. Read on for a sample of what&#8217;s been added recently and some of our &hellip;
LC Labs Letter: Summer Recap,2023-08-14,https://blogs.loc.gov/thesignal/2023/08/lc-labs-letter-summer-recap/,Summer recap of activities undertaken by the LC Labs team.
Growing the File Format Fam,2023-12-14,https://blogs.loc.gov/thesignal/2023/12/growing-the-file-format-fam/,"This post is part of the semi-annual blog series on file format research for the Sustainability of Digital Formats site at the Library of Congress, and provides updates on new and updated file format description documents."
"Meet Olivia Charmaine Morris: A Champion for ""People of Color and Colorful People""",2023-06-22,https://blogs.loc.gov/copyright/2023/06/meet-olivia-charmaine-morris-a-champion-for-people-of-color-and-colorful-people/,"June is Lesbian, Gay, Bisexual, Transgender, and Queer (LGBTQ+) Pride Month, when we recognize the history and impact of LGBTQ individuals in the United States. This year, the Copyright Office celebrates Pride Month and extends our World Intellectual Property Day campaign by spotlighting Olivia Charmaine Morris (she/her), who is a queer media mogul and entrepreneur &hellip;"
"Talavera Ceramics: At the Intersection of Art, History, and Law in Mexico",2023-09-27,https://blogs.loc.gov/law/2023/09/talavera-ceramics-at-the-intersection-of-art-history-and-law-in-mexico/,"This post discusses the history of Talavera pottery, the laws that protect it in Mexico, and UNESCO recognition of its craftsmanship."
The crowdsourced transcription lifecycle – from conception to retirement,2023-05-16,https://blogs.loc.gov/thesignal/2023/05/btp-retirements/,"Today&#8217;s guest post is from Lauren Algee, a Senior Collections Specialist in the Digital Content Management Section and a&#xA0;By the People community manager. After years of service from thousands of volunteers, some of the oldest completed By the People crowdsourced transcription campaigns are celebrating their retirement! This week, the By the People team retired 10 &hellip;"
