Title,Date,URL,Description
China : regulation of artificial intelligence,2023,http://www.loc.gov/item/2023555933/,"""LL File No. 2023-022300."" ""June 2023."" Includes bibliographical references. Description based on online resource, PDF version; title from cover (LOC, viewed Jan. 11, 2024)."
GAO's Artificial Intelligence Accountability Framework,2023-11-15,http://www.loc.gov/item/webcast-11232/,"Artificial Intelligence (AI) is a transformative technology and can enhance and improve government operations. Accountable and responsible use will be key. In June 2021, the US Government Accountability Office -- a research and evaluation arm of Congress -- issued an accountability framework for federal agencies who manage, operate and oversee AI."
Regulation of artificial intelligence around the world,2023,http://www.loc.gov/item/2023555920/,"""LL File No. 2023-022541."" ""August 2023."" Description based on online resource, PDF version; title from cover (LOC, viewed Sept. 5, 2023)."
Copyright Office Launches New Artificial Intelligence Initiative,2023-03-16,http://www.loc.gov/item/prn-23-032/,"<p><span>The U.S. Copyright Office today launched a new initiative to examine the copyright law and policy issues raised by artificial intelligence, including the scope of copyright in works generated using AI tools and the use of copyrighted materials in AI training.</span></p><p><span>This initiative is in direct response to the recent striking advances in generative AI technologies and their rapidly growing use by individuals and businesses. The Copyright Office has received requests from Congress and members of the public, including creators and AI users, to examine the issues raised for copyright, and it is already receiving applications for registration of works including AI-generated content.</span></p><p><span>To address the copyrightability and registration issues raised by these works, the Copyright Office is issuing new </span><a href=""https://www.govinfo.gov/content/pkg/FR-2023-03-16/pdf/2023-05321.pdf""><span>registration guidance</span></a><span>. The guidance makes clear that applicants have a"
An introduction to artificial intelligence for federal judges,2023,http://lccn.loc.gov/2020449286,"In scope of the U.S. Government Publishing Office Cataloging and Indexing Program (C&I) and Federal Depository Library Program (FDLP). Includes bibliographical references. Description based on online resource; title from PDF title page (FJC, viewed April 11, 2023)."
China: Cyberspace Authority Releases Draft Measures Regulating Generative Artificial Intelligence,2023-07-04,http://www.loc.gov/item/global-legal-monitor/2023-07-04/china-cyberspace-authority-releases-draft-measures-regulating-generative-artificial-intelligence/,"<p>On April 11, 2023, the Cyberspace Administration of China (CAC) released draft measures to regulate the provision of generative artificial intelligence (AI) services — for example, ChatGPT — to solicit comments from the public on the proposed measures. The Measures for the Management of Generative Artificial Intelligence Services (Draft for Comment) (unofficial English translation) aim &hellip; </p> <p class=""link-more""><a href=""https://www.loc.gov/item/global-legal-monitor/2023-07-04/china-cyberspace-authority-releases-draft-measures-regulating-generative-artificial-intelligence/"" class=""more-link"">Continue reading<span class=""screen-reader-text""> &#8220;China: Cyberspace Authority Releases Draft Measures Regulating Generative Artificial Intelligence&#8221;</span></a></p>"
H.R.3369 - 118th Congress (2023-2024): Artificial Intelligence Accountability Act,2023-10-25,https://www.congress.gov/bill/118th-congress/house-bill/3369,Summary of H.R.3369 - 118th Congress (2023-2024): Artificial Intelligence Accountability Act
Introducing the Law Library's New Multi-jurisdiction Report on Regulation of Artificial Intelligence Around the World,2023-09-26,https://blogs.loc.gov/law/2023/09/introducing-the-law-librarys-new-multi-jurisdiction-report-on-regulation-of-artificial-intelligence-around-the-world/,"The blog post introduces the new Law Library report on ""Regulation of Artificial Intelligence Around the World."""
Introducing the LC Labs Artificial Intelligence Planning Framework,2023-11-15,https://blogs.loc.gov/thesignal/2023/11/introducing-the-lc-labs-artificial-intelligence-planning-framework/,LC Labs has been developing a planning framework to support the responsible exploration and potential adoption of AI at the Library.
China's AI exports : technology distribution and data safety,2023,http://lccn.loc.gov/2024443639,"In recent years, China's aspiration for global technology leadership has driven its significant investments in artificial intelligence (AI) for national security, economic growth, and societal well-being. Although there is increasing research and analysis on China's domestic AI development ecosystems and drivers, the details of China's development-financed AI exports remain elusive. Despite being the single-largest provider of foreign development assistance, Beijing does not participate in aid or debt transparency initiatives. To address this gap, researchers from the RAND Corporation and AidData jointly built a new database on China's AI export projects that are funded with official development financing: China's AI Exports Database (CAIED). CAIED uses data from multiple public databases and indexes related to China's global financing and recipient countries' electoral democracy, freedom, and data protection and privacy status. In this report, the authors analyze this quantitative dataset--adding qualitative country case studies based on interviews and social media analysis--to examine the distribution, technology, financing, and data safety aspects of China's AI exports."
S.3050 - 118th Congress (2023-2024): Artificial Intelligence Advancement Act of 2023,2023-10-17,https://www.congress.gov/bill/118th-congress/senate-bill/3050,Summary of S.3050 - 118th Congress (2023-2024): Artificial Intelligence Advancement Act of 2023
Copyright Office Issues Notice of Inquiry on Copyright and Artificial Intelligence,2023-08-30,http://www.loc.gov/item/prn-23-076/,"<p>The U.S. Copyright Office today issued a notice of inquiry in Federal Register on copyright and artificial intelligence. The Copyright Office is undertaking a study of the copyright law and policy issues raised by generative AI and is assessing whether legislative or regulatory steps are warranted.</p><p>The Copyright Office will use the record it assembles to advise Congress; inform its regulatory work; and offer information and resources to the public, courts, and other government entities considering these issues.</p><p>The notice of inquiry seeks factual information and views on a number of copyright issues raised by recent advances in generative AI. These issues include the use of copyrighted works to train AI models, the appropriate levels of transparency and disclosure with respect to the use of copyrighted works, the legal status"
New Law Library Report on Safety and Security of Artificial Intelligence Systems Published,2023-08-17,https://blogs.loc.gov/law/2023/08/new-law-library-report-on-safety-and-security-of-artificial-intelligence-systems-published/,"The blog post introduces the new Law Library report on ""Safety and Security of Artificial Intelligence Systems."""
Library of Congress Hosts Virtual Panel on Artificial Intelligence and Cancer,2023-11-28,http://www.loc.gov/item/prn-23-100/,"<p>The Library of Congress will host its annual Cancer Moonshot panel discussion on Tuesday, Dec. 5 at 11 a.m. Led by the Health Services Division and the Researcher Engagement and General Collections Division at the Library, the virtual event will bring together renowned international experts working on artificial intelligence for cancer screening, immunotherapy, imaging, and the ethics involved in using AI to provide their insight on this important topic.</p><p>What: Virtual Cancer Moonshot Panel</p><p>When: Tuesday, Dec. 5, 11 a.m. – 1 p.m.</p><p>Where: Online. Please <a href=""https://loc.zoomgov.com/webinar/register/WN_kaBLi2OtTfS34tDH0VGNFQ#/registration"">register here</a>. Registration is required and limited to 1,000 participants.</p><p>Who: Confirmed panelists include:</p><ul><li><a href=""https://www.linkedin.com/in/dr-catharine-young-25959148/"">Catharine Young</a>, assistant director for Cancer Moonshot Policy and International Engagement. Young will provide an overview of the progress made through the Moonshot Initiative.</li></ul><ul><li><a href=""https://www.roswellpark.org/brian-betts"">Brian Betts</a>, professor of Oncology, the University at"
S.2502 - 118th Congress (2023-2024): Artificial Intelligence Bug Bounty Act of 2023,2023-07-26,https://www.congress.gov/bill/118th-congress/senate-bill/2502,Summary of S.2502 - 118th Congress (2023-2024): Artificial Intelligence Bug Bounty Act of 2023
H.R.6791 - 118th Congress (2023-2024): Artificial Intelligence Literacy Act of 2023,2023-12-15,https://www.congress.gov/bill/118th-congress/house-bill/6791,Summary of H.R.6791 - 118th Congress (2023-2024): Artificial Intelligence Literacy Act of 2023
S.2399 - 118th Congress (2023-2024): Artificial Intelligence and Biosecurity Risk Assessment Act,2023-07-19,https://www.congress.gov/bill/118th-congress/senate-bill/2399,Summary of S.2399 - 118th Congress (2023-2024): Artificial Intelligence and Biosecurity Risk Assessment Act
S.3205 - 118th Congress (2023-2024): Federal Artificial Intelligence Risk Management Act of 2023,2023-11-02,https://www.congress.gov/bill/118th-congress/senate-bill/3205,Summary of S.3205 - 118th Congress (2023-2024): Federal Artificial Intelligence Risk Management Act of 2023
H.R.4704 - 118th Congress (2023-2024): Artificial Intelligence and Biosecurity Risk Assessment Act,2023-07-21,https://www.congress.gov/bill/118th-congress/house-bill/4704,Summary of H.R.4704 - 118th Congress (2023-2024): Artificial Intelligence and Biosecurity Risk Assessment Act
Our Summer of Artificial Intelligence: Copyright Office Hosts Two Webinars on Copyright and AI,2023-08-23,https://blogs.loc.gov/copyright/2023/08/our-summer-of-artificial-intelligence-copyright-office-hosts-two-webinars-on-copyright-and-ai/,"In June and July 2023, the Copyright Office hosted two public virtual webinars on the use of artificial intelligence technologies to generate works in creative fields. This blog post provides a brief recap of and links to the webinars, which focused on copyright registration guidance for AI-generated works and perspectives on how AI impacts copyright systems across the globe."
"S.3312 - 118th Congress (2023-2024): Artificial Intelligence Research, Innovation, and Accountability Act of 2023",2023-11-15,https://www.congress.gov/bill/118th-congress/senate-bill/3312,"Summary of S.3312 - 118th Congress (2023-2024): Artificial Intelligence Research, Innovation, and Accountability Act of 2023"
"Safety and security of artificial intelligence systems : Australia, Canada, European Union, New Zealand, United Kingdom",2023,http://www.loc.gov/item/2023555908/,"""LL File No. 2023-022302."" ""July 2023."" Description based on online resource, PDF version; title from cover (LOC, viewed July 28, 2023)."
H.Res.66 - 118th Congress (2023-2024): Expressing support for Congress to focus on artificial intelligence.,2023-01-26,https://www.congress.gov/bill/118th-congress/house-resolution/66,Summary of H.Res.66 - 118th Congress (2023-2024): Expressing support for Congress to focus on artificial intelligence.
S.1394 - 118th Congress (2023-2024): Block Nuclear Launch by Autonomous Artificial Intelligence Act of 2023,2023-05-01,https://www.congress.gov/bill/118th-congress/senate-bill/1394,Summary of S.1394 - 118th Congress (2023-2024): Block Nuclear Launch by Autonomous Artificial Intelligence Act of 2023
H.R.2894 - 118th Congress (2023-2024): Block Nuclear Launch by Autonomous Artificial Intelligence Act of 2023,2023-04-26,https://www.congress.gov/bill/118th-congress/house-bill/2894,Summary of H.R.2894 - 118th Congress (2023-2024): Block Nuclear Launch by Autonomous Artificial Intelligence Act of 2023
S.2346 - 118th Congress (2023-2024): Strategy for Public Health Preparedness and Response to Artificial Intelligence Threats,2023-07-18,https://www.congress.gov/bill/118th-congress/senate-bill/2346,Summary of S.2346 - 118th Congress (2023-2024): Strategy for Public Health Preparedness and Response to Artificial Intelligence Threats
"H.Res.649 - 118th Congress (2023-2024): Calling on the United States to champion a regional artificial intelligence strategy in the Americas to foster inclusive artificial intelligence systems that combat biases within marginalized groups and promote social justice, economic well-being, and democratic values.",2023-08-08,https://www.congress.gov/bill/118th-congress/house-resolution/649,"Summary of H.Res.649 - 118th Congress (2023-2024): Calling on the United States to champion a regional artificial intelligence strategy in the Americas to foster inclusive artificial intelligence systems that combat biases within marginalized groups and promote social justice, economic well-being, and democratic values."
H.R.4683 - 118th Congress (2023-2024): Closing Loopholes for the Overseas Use and Development of Artificial Intelligence Act,2023-07-17,https://www.congress.gov/bill/118th-congress/house-bill/4683,Summary of H.R.4683 - 118th Congress (2023-2024): Closing Loopholes for the Overseas Use and Development of Artificial Intelligence Act
"Artificial intelligence-based student activity monitoring for suicide risk : considerations for K-12 schools, caregivers, government, and technology developers",2023,http://lccn.loc.gov/2024402303,"In response to the widespread youth mental health crisis, some kindergarten-through-12th-grade (K-12) schools have begun employing artificial intelligence (AI)-based tools to help identify students at risk for suicide and self-harm. The adoption of AI and other types of educational technology to partially address student mental health needs has been a natural forward step for many schools during the transition to remote education. However, there is limited understanding about how such programs work, how they are implemented by schools, and how they may benefit or harm students and their families. To assist policymakers, school districts, school leaders, and others in making decisions regarding the use of these tools, the authors address these knowledge gaps by providing a preliminary examination of how AI-based suicide risk monitoring programs are implemented in K-12 schools, how stakeholders perceive the effects that the programs are having on students, and the potential benefits and risks of such tools. Using this analysis, the authors also offer recommendations for school and district leaders; state, federal, and local policymakers; and technology developers to consider as they move forward in maximizing the intended benefits and mitigating the possible risks of AI-based suicide risk monitoring programs."
H.R.5077 - 118th Congress (2023-2024): Creating Resources for Every American To Experiment with Artificial Intelligence Act of 2023,2023-07-28,https://www.congress.gov/bill/118th-congress/house-bill/5077,Summary of H.R.5077 - 118th Congress (2023-2024): Creating Resources for Every American To Experiment with Artificial Intelligence Act of 2023
S.1993 - 118th Congress (2023-2024): A bill to waive immunity under section 230 of the Communications Act of 1934 for claims and charges related to generative artificial intelligence.,2023-06-14,https://www.congress.gov/bill/118th-congress/senate-bill/1993,Summary of S.1993 - 118th Congress (2023-2024): A bill to waive immunity under section 230 of the Communications Act of 1934 for claims and charges related to generative artificial intelligence.
Outsmarting Agile Adversaries in the Electromagnetic Spectrum Executive Summary,2023,http://lccn.loc.gov/2023275233,"The U.S. Air Force's electronic warfare integrated reprogramming (EWIR) enterprise examines intelligence on adversary threats that emit in the electromagnetic spectrum (EMS) (in particular, radars and jammers) and configures electronic warfare software and hardware to enable aircraft or other resources to react to and/or respond to adverse changes in the EMS environment. With the growing advancements in U.S. adversaries' electronic warfare assets that enable complex and diverse EMS capabilities, identifying, tracking, and responding to these threats requires much faster updates than the existing EWIR enterprise was designed for. The research team conducted four interrelated technology case studies that together comprise the fundamental elements necessary for creating a near-real-time, autonomous, inflight software reprogramming capability and, more specifically, artificial intelligence-enabled cognitive electronic warfare capabilities-the use of machine learning algorithms that enable platforms to learn, reprogram, adapt, and effectively counter threats in flight. The research team also highlighted important continuing roles for the existing EWIR enterprise even as the U.S. Air Force moves toward a cognitive future. This executive summary encapsulates the findings in Outsmarting Agile Adversaries in the Electromagnetic Spectrum(RR-A981-1) 2023."
"S.3004 - 118th Congress (2023-2024): A bill to specify control and management of Department of Defense data and to establish the Chief Digital and Artificial Intelligence Officer Governing Council, and for other purposes.",2023-10-03,https://www.congress.gov/bill/118th-congress/senate-bill/3004,"Summary of S.3004 - 118th Congress (2023-2024): A bill to specify control and management of Department of Defense data and to establish the Chief Digital and Artificial Intelligence Officer Governing Council, and for other purposes."
"H.R.6425 - 118th Congress (2023-2024): To direct the Secretary of Defense to establish a working group to develop and coordinate an artificial intelligence initiative among the Five Eyes countries, and for other purposes.",2023-11-15,https://www.congress.gov/bill/118th-congress/house-bill/6425,"Summary of H.R.6425 - 118th Congress (2023-2024): To direct the Secretary of Defense to establish a working group to develop and coordinate an artificial intelligence initiative among the Five Eyes countries, and for other purposes."
"Join Us on 5/18 for a Foreign and Comparative Law Webinar, ""E-Governance and E-Voting in the Baltic States: Leaders of E-Transformation""",2023-04-28,https://blogs.loc.gov/law/2023/04/join-us-on-5-18-for-a-foreign-and-comparative-law-webinar-e-governance-and-e-voting-in-the-baltic-states-leaders-of-e-transformation/,Announcing our latest Foreign and Comparative Law Webinar on E-Governance and E-Voting in the Baltic States.
Inclusion in AI : is there a Singapore model?,2023,http://lccn.loc.gov/2023331830,"""March 2023."" Includes bibliographical references. In English. Title from PDF file as viewed on 11/03/2023."
2023 American Folklife Center Mummers Holiday Play in the Great Hall,2023-12-13,http://www.loc.gov/item/event-411348/,"The American Folklife Center Mummers will present the annual mummers’ play in the Great Hall at 3:15 p.m. on December 13. This year’s play is called “Artificial Intelligence Meets Natural Stupidity: A Literary Ball Mumming.” When Artificial Intelligence tries to make writers obsolete, can St. George Eliot, Sherlock Holmes and Enola Holmes save the day? Find out in this play set at the North Pole Library Literary Ball. Sing along on the carols and dance to traditional tunes as well!"
International Women's Day Keynote Speaker: Vivienne Ming,2023-03-22,http://www.loc.gov/item/webcast-10750/,"An inspiring program featuring Vivienne Ming, neuroscientist, entrepreneur, inventor and artificial intelligence expert as keynote speaker on inclusion and the future of work."
TechnoLlama,2010,http://www.loc.gov/item/lcwaN0004846/,"TechnoLlama is a technology law blog dedicated to informative, deep, yet light-hearted coverage of cyberlaw topics, with an emphasis on artificial intelligence, internet regulation, and cryptocurrencies.  Website.   electronic |   Electronic (Form)."
Cancer Moonshot: 2023 Panel Discussion,2023-12-05,http://www.loc.gov/item/webcast-11206/,"This year's panel discussion on the Cancer Moonshot initiative brought together leading scientists working on artificial intelligence to discuss AI for cancer screening, immunotherapy, imaging and the ethics involved in using AI technology."
International Women's Day Symposium: Women Leadership in Tech and Investment,2023-03-08,http://www.loc.gov/item/event-408024/,"Attend an inspiring program featuring Dr. Vivienne Ming, neuroscientist, entrepreneur, inventor, and artificial intelligence expert as keynote, speaking on the tax of being different as an entrepreneur and investor, and about her career path."
2023 Law Library of Congress Research Reports,2023-11-30,http://www.loc.gov/item/webcast-11199/,"This presentation highlighted some of the Law Library of Congress legal reports published in 2023. These included reports on immigration, artificial intelligence, environmental issues and lobbying. The highlighted reports on immigration covered the topics of unaccompanied asylum-seeking minors and whether humanitarian protection can be claimed from outside the country. One area that has been of great interest internationally is the development of artificial intelligence. The Law Library produced two reports on this topic that were discussed. Environmental reports that cover net zero emissions and the regulation of hemp were also included along with a report on lobbying and the registration of foreign agents. The presentation also reviewed some of the top-performing blog posts and Global Legal Monitor articles for the past year."
Cancer Moonshot Panel Webinar will Discuss AI and Cancer on December 5,2023-11-27,https://blogs.loc.gov/inside_adams/2023/11/cancermoonshot/,"The Library of Congress will be hosting a virtual panel discussion on Artificial Intelligence (AI) in cancer diagnostics and treatment on December 5, 2023. This event is sponsored by the Library's Health Services Division and Science Section and is part of its annual Cancer Moonshot series."
Happy Holidays! AFC's 2023 Literary Ball Mummers Play Video,2023-12-22,https://blogs.loc.gov/folklife/2023/12/happy-holidays-afcs-2023-literary-ball-mummers-play-video/,"Happy holidays from the American Folklife Center! Watch a video of the AFC Mummers performing our 2023 mummers play! Then you can read the play, see the pictures, and even read the annotations if you’re interested in the history of holiday customs. This year’s play is called “Artificial Intelligence Meets Natural Stupidity: A Literary Ball Mumming.” When Artificial Intelligence tries to make writers obsolete, can St. George Eliot, Sherlock Holmes and Enola Holmes save the day? Find out in this play set at the North Pole Library Literary Ball, which includes wassailing carols and dancing to traditional tunes as well!  Mummers plays are short plays which were traditionally performed in Britain, Ireland, colonial America and the West Indies at holiday time. Mummers went from house to house and pub to pub, collecting food, drink and small change as a reward for their entertainment. The American Folklife Center’s archive boasts a large collections of British mummers play texts in its James Madison Carpenter Collection."
#ICYMI: The Copyright Office Hears from Stakeholders on Important Issues with AI and Copyright,2023-07-18,https://blogs.loc.gov/copyright/2023/07/icymi-the-copyright-office-hears-from-stakeholders-on-important-issues-with-ai-and-copyright/,"In April and May 2023, the Copyright Office hosted four public, virtual listening sessions on the use of artificial intelligence to generates works in creative fields. The listening sessions focused on four different categories of works: literary works, including print journalism and software; visual arts; audiovisual works, including video games; and music and sound recordings. This blog post provides a brief recap of the four listening sessions."
